Folder,DOI,Publication_link,Title,Abstract,Scientific_Name,Common_Name,Sharing_Link,Requires_Authorization,Phenotype,Map,Pedigree,N_Geno,N_markers,Download_Instructions,Tags
00085_GenomicAssociationMappingRice,https://doi.org/10.5061/dryad.7369p,https://journals.plos.org/plosgenetics/article?id=10.1371/journal.pgen.1004982,"Genomic Selection and Association Mapping in Rice (Oryza sativa): Effect of Trait Genetic Architecture, Training Population Composition, Marker Number and Statistical Model on Accuracy of Rice Genomic Selection in Elite, Tropical Rice Breeding Lines","Genomic Selection (GS) is a new breeding method in which genome-wide markers are used to predict the breeding value of individuals in a breeding population. GS has been shown to improve breeding efficiency in dairy cattle and several crop plant species, and here we evaluate for the first time its efficacy for breeding inbred lines of rice. We performed a genome-wide association study (GWAS) in conjunction with five-fold GS cross-validation on a population of 363 elite breeding lines from the International Rice Research Institute's (IRRI) irrigated rice breeding program and herein report the GS results. The population was genotyped with 73,147 markers using genotyping-by-sequencing. The training population, statistical method used to build the GS model, number of markers, and trait were varied to determine their effect on prediction accuracy. For all three traits, genomic prediction models outperformed prediction based on pedigree records alone. Prediction accuracies ranged from 0.31 and 0.34 for grain yield and plant height to 0.63 for flowering time. Analyses using subsets of the full marker set suggest that using one marker every 0.2 cM is sufficient for genomic selection in this collection of rice breeding materials. RR-BLUP was the best performing statistical method for grain yield where no large effect QTL were detected by GWAS, while for flowering time, where a single very large effect QTL was detected, the non-GS multiple linear regression method outperformed GS models. For plant height, in which four mid-sized QTL were identified by GWAS, random forest produced the most consistently accurate GS models. Our results suggest that GS, informed by GWAS interpretations of genetic architecture and population structure, could become an effective tool for increasing the efficiency of rice breeding as the costs of genotyping continue to decline.",Oryza sativa,Rice,https://datadryad.org/stash/dataset/doi:10.5061/dryad.7369p,FALSE,TRUE,FALSE,FALSE,369,108024,NA,genomic selection; rice breeding; GWAS; prediction accuracy; marker-assisted selection; genetic architecture; breeding efficiency; genotyping-by-sequencing
00086_MiscanthusSinensisMultiLocationTrial,https://doi.org/10.13012/B2IDB-0790815_V3,NA,"Miscanthus sinensis multi-location trial: phenotypic analysis, genome-wide association, and genomic prediction","This dataset contains genotypic and phenotypic data, R scripts, and the results of analysis pertaining to a multi-location field trial of Miscanthus sinensis. Genome-wide association and genomic prediction were performed for biomass yield and 14 yield-component traits across six field trial locations in Asia and North America, using 46,177 single-nucleotide polymorphism (SNP) markers mined from restriction site-associated DNA sequencing (RAD-seq) and 568 M. sinensis accessions. Genomic regions and candidate genes were identified that can be used for breeding improved varieties of M. sinensis, which in turn will be used to generate new M. xgiganteus clones for biomass.",Miscanthus sinensis,Chinese silver grass,https://databank.illinois.edu/datasets/IDB-1182845,FALSE,TRUE,FALSE,FALSE,594,46177,Read README file and download required files.,genomics; phenotypics; genome-wide association study; genomic prediction; Miscanthus sinensis; single-nucleotide polymorphism; biomass yield; breeding improvement
00087_MultiTraitPredictionPerennialRyegrass,https://doi.org/10.25387/g3.10074323.v1,https://www.frontiersin.org/journals/plant-science/articles/10.3389/fpls.2020.01197/full,Multi-Trait Genomic Prediction Improves Predictive Ability for Dry Matter Yield and Water-Soluble Carbohydrates in Perennial Ryegrass,"In perennial ryegrass (Lolium perenne L), annual and seasonal dry matter yield (DMY) and nutritive quality of herbage are high-priority traits targeted for improvement through selective breeding. Genomic prediction (GP) has proven to be a valuable tool for improving complex traits and may be further enhanced through the use of multi-trait (MT) prediction models. In this study, we evaluated the relative performance of MT prediction models to improve predictive ability for DMY and key nutritive quality traits, using two different training populations (TP1, n = 463 and TP2, n = 517) phenotyped at multiple locations. MT models outperformed single-trait (ST) models by 24% to 59% for DMY and 67% to 105% for nutritive quality traits, such as low, high, and total WSC, when a correlated secondary trait was included in both the training and test set (MT-CV2) or in the test set alone (MT-CV3) (trait-assisted genomic selection). However, when a secondary trait was included in training set and not the test set (MT-CV1), the predictive ability was not statistically significant (p > 0.05) compared to the ST model. We evaluated the impact of training set size when using a MT-CV2 model. Using a highly correlated trait (rg = 0.88) as the secondary trait in the MT-CV2 model, there was no loss in predictive ability for DMY even when the training set was reduced to 50% of its original size. In contrast, using a weakly correlated secondary trait (rg = 0.56) in the MT-CV2 model, predictive ability began to decline when the training set size was reduced by only 11% from its original size. Using a ST model, genomic predictive ability in a population unrelated to the training set was poor (rp = −0.06). However, when using an MT-CV2 model, the predictive ability was positive and high (rp = 0.76) for the same population. Our results demonstrate the first assessment of MT models in forage species and illustrate the prospects of using MT genomic selection in forages, and other outcrossing plant species, to accelerate genetic gains for complex agronomical traits, such as DMY and nutritive quality characteristics.",Lolium perenne,Perennial ryegrass,https://gsajournals.figshare.com/articles/dataset/Supplemental_Material_for_Arojju_et_al_2020/10074323,FALSE,TRUE,FALSE,FALSE,517,1023010,NA,genomic prediction; selective breeding; multi-trait models; dry matter yield; nutritive quality; perennial ryegrass; genomic selection; agronomical traits
00088_GenomicAdaptiveDivergenceManakins,https://doi.org/10.5061/dryad.85078,https://onlinelibrary.wiley.com/doi/10.1111/mec.12201,The genomic consequences of adaptive divergence and reproductive isolation between species of manakins,"The processes of adaptation and speciation are expected to shape genomic variation within and between diverging species. Here we analyze genomic heterogeneity of genetic differentiation and introgression in a hybrid zone between two bird species (Manacus candei and M. vitellinus) using 59 100 SNPs, a whole genome assembly, and Bayesian models. Measures of genetic differentiation (urn:x-wiley:09621083:media:mec12201:mec12201-math-0001) and introgression (genomic cline center [α] and rate [β]) were highly heterogeneous among loci. We identified thousands of loci with elevated parameter estimates, some of which are likely to be associated with variation in fitness in Manacus populations. To analyze the genomic organization of differentiation and introgression, we mapped SNPs onto a draft assembly of the M. vitellinus genome. Estimates of urn:x-wiley:09621083:media:mec12201:mec12201-math-0002, α, and β were autocorrelated at very short physical distances (< 100 bp), but much less so beyond this. In addition, average statistical associations (linkage disequilibrium) between SNPs were generally low and were not higher in admixed populations than in populations of the parental species. Although they did not occur with a constant probability across the genome, loci with elevated urn:x-wiley:09621083:media:mec12201:mec12201-math-0003, α, and β were not strongly co-localized in the genome. Contrary to verbal models that predict clustering of loci involved in adaptation and isolation in discrete genomic regions, these results are consistent with the hypothesis that genetic regions involved in adaptive divergence and reproductive isolation are scattered throughout the genome. We also found that many loci were characterized by both exceptional genetic differentiation and introgression, consistent with the hypothesis that loci involved in isolation are also often characterized by a history of divergent selection. However, the concordance between isolation and differentiation was only partial, indicating a complex architecture and history of loci involved in isolation.",Manacus candei,White-collared manakin,https://datadryad.org/stash/dataset/doi:10.5061/dryad.85078,FALSE,FALSE,FALSE,FALSE,96,39319456,NA,genomics; speciation; introgression; genetic differentiation; hybrid zone; Bayesian models; adaptation; evolutionary biology
00089_AdaptiveCapacityToClimateInAustralia,https://doi.org/10.5061/dryad.03g3s3q,https://onlinelibrary.wiley.com/doi/10.1111/mec.15092,Standing genomic variation within coding and regulatory regions contributes to the adaptive capacity to climate in a foundation tree species,"Global climate is rapidly changing, and the ability for tree species to adapt is dependent on standing genomic variation; however, the distribution and abundance of functional and adaptive variants are poorly understood in natural systems. We test key hypotheses regarding the genetics of adaptive variation in a foundation tree: genomic variation is associated with climate, and genomic variation is more likely to be associated with temperature than precipitation or aridity. To test these hypotheses, we used 9,593 independent, genomic single-nucleotide polymorphisms (SNPs) from 270 individuals sampled from Corymbia calophylla's entire distribution in south-western Western Australia, spanning orthogonal temperature and precipitation gradients. Environmental association analyses returned 537 unique SNPs putatively adaptive to climate. We identified SNPs associated with climatic variation (i.e., temperature [458], precipitation [75] and aridity [78]) across the landscape. Of these, 78 SNPs were nonsynonymous (NS), while 26 SNPs were found within gene regulatory regions. The NS and regulatory candidate SNPs associated with temperature explained more deviance (27.35%) than precipitation (5.93%) and aridity (4.77%), suggesting that temperature provides stronger adaptive signals than precipitation. Genes associated with adaptive variants include functions important in stress responses to temperature and precipitation. Patterns of allelic turnover of NS and regulatory SNPs show small patterns of change through climate space with the exception of an aldehyde dehydrogenase gene variant with 80% allelic turnover with temperature. Together, these findings provide evidence for the presence of adaptive variation to climate in a foundation species and provide critical information to guide adaptive management practices.",Corymbia calophylla,Marri,https://datadryad.org/stash/dataset/doi:10.5061/dryad.03g3s3q,FALSE,TRUE,FALSE,FALSE,263,9593,NA,climate change; genomic variation; adaptive genetics; single-nucleotide polymorphisms (SNPs); environmental association analysis; tree adaptation; Corymbia calophylla; adaptive management practices
00090_InferencesSNPsPatternsMicrosatellites,https://doi.org/10.5061/dryad.40c7c,https://onlinelibrary.wiley.com/doi/10.1111/1755-0998.12591,Population genetic inferences using immune gene SNPs mirror patterns inferred by microsatellites,"Single nucleotide polymorphisms (SNPs) are replacing microsatellites for population genetic analyses, but it is not apparent how many SNPs are needed or how well SNPs correlate with microsatellites. We used data from the gopher tortoise, Gopherus polyphemus—a species with small populations, to compare SNPs and microsatellites to estimate population genetic parameters. Specifically, we compared one SNP data set (16 tortoises from four populations sequenced at 17 901 SNPs) to two microsatellite data sets, a full data set of 101 tortoises and a partial data set of 16 tortoises previously genotyped at 10 microsatellites. For the full microsatellite data set, observed heterozygosity, expected heterozygosity and FST were correlated between SNPs and microsatellites; however, allelic richness was not. The same was true for the partial microsatellite data set, except that allelic richness, but not observed heterozygosity, was correlated. The number of clusters estimated by structure differed for each data set (SNPs = 2; partial microsatellite = 3; full microsatellite = 4). Principle component analyses (PCA) showed four clusters for all data sets. More than 800 SNPs were needed to correlate with allelic richness, observed heterozygosity and expected heterozygosity, but only 100 were needed for FST. The number of SNPs typically obtained from next-generation sequencing (NGS) far exceeds the number needed to correlate with microsatellite parameter estimates. Our study illustrates that diversity, FST and PCA results from microsatellites can mirror those obtained with SNPs. These results may be generally applicable to small populations, a defining feature of endangered and threatened species, because theory predicts that genetic drift will tend to outweigh selection in small populations.",Gopherus polyphemus,Gopher tortoise,https://datadryad.org/stash/dataset/doi:10.5061/dryad.40c7c,FALSE,FALSE,TRUE,FALSE,16,17901,NA,population genetics; SNPs; microsatellites; gopher tortoise; genetic diversity; next-generation sequencing; FST; endangered species
00091_PumpkinHybridPerformance,https://doi.org/10.5061/dryad.ts718t2,https://acsess.onlinelibrary.wiley.com/doi/10.3835/plantgenome2018.10.0082,Genomic prediction of pumpkin hybrid performance,"Genomic prediction has become an increasingly popular tool for hybrid performance evaluation in plant breeding mainly because that it can reduce cost and accelerate a breeding program. In this study, we propose a systematic procedure to predict hybrid performance using a genomic selection (GS) model that takes both additive and dominance marker effects into account. We first demonstrate the advantage of the additive–dominance effects model over the only additive effects model through a simulation study. Based on the additive–dominance model, we predict genomic estimated breeding values (GEBVs) for individual hybrid combinations and their parental lines. The GEBV-based specific combining ability (SCA) for each hybrid and general combining ability (GCA) for its parental lines are then derived to quantify the degree of midparent heterosis (MPH) or better-parent heterosis (BPH) of the hybrid. Finally, we estimate the variance components resulting from additive and dominance gene action effects and heritability using a genomic best linear unbiased predictor (g-BLUP) model. These estimates are used to justify the results of the genomic prediction study. A pumpkin (Cucurbita spp.) data set is given to illustrate the provided procedure. The data set consists of 320 parental lines with 61,179 collected single nucleotide polymorphism (SNP) markers; 119, 120, and 120 phenotypic values of hybrids on three quantitative traits within C.maxima Duchesne; and 89, 111, and 90 phenotypic values of hybrids on the same three quantitative traits within C. moshata Dechesne.",Cucurbita moschata,Crookneck pumpkin,https://datadryad.org/stash/dataset/doi:10.5061/dryad.ts718t2,FALSE,TRUE,FALSE,FALSE,10153,4522,NA,genomic prediction; hybrid performance; plant breeding; genomic selection model; marker effects; heritability; heterosis; single nucleotide polymorphism (SNP)
00092_GenomicPredictionSoaySheepCoatcolour,https://doi.org/10.5061/dryad.h44j0zpkq,https://onlinelibrary.wiley.com/doi/10.1111/mec.16262,Genomic prediction in the wild: A case study in Soay sheep,"Genomic prediction, the technique whereby an individual's genetic component of their phenotype is estimated from its genome, has revolutionised animal and plant breeding and medical genetics. However, despite being first introduced nearly two decades ago, it has hardly been adopted by the evolutionary genetics community studying wild organisms. Here, genomic prediction is performed on eight traits in a wild population of Soay sheep. The population has been the focus of a >30 year evolutionary ecology study and there is already considerable understanding of the genetic architecture of the focal Mendelian and quantitative traits. We show that the accuracy of genomic prediction is high for all traits, but especially those with loci of large effect segregating. Five different methods are compared, and the two methods that can accommodate zero-effect and large-effect loci in the same model tend to perform best. If the accuracy of genomic prediction is similar in other wild populations, then there is a real opportunity for pedigree-free molecular quantitative genetics research to be enabled in many more wild populations; currently the literature is dominated by studies that have required decades of field data collection to generate sufficiently deep pedigrees. Finally, some of the potential applications of genomic prediction in wild populations are discussed.",Ovis aries,Sheep,https://datadryad.org/stash/dataset/doi:10.5061/dryad.h44j0zpkq,FALSE,TRUE,FALSE,FALSE,4737,35885,NA,genomic prediction; evolutionary genetics; animal breeding; plant breeding; medical genetics; Soay sheep; quantitative traits; molecular genetics
00093_GenomicPredictionSoaySheepCoatpattern,https://doi.org/10.5061/dryad.h44j0zpkq,https://onlinelibrary.wiley.com/doi/10.1111/mec.16262,Genomic prediction in the wild: A case study in Soay sheep,"Genomic prediction, the technique whereby an individual's genetic component of their phenotype is estimated from its genome, has revolutionised animal and plant breeding and medical genetics. However, despite being first introduced nearly two decades ago, it has hardly been adopted by the evolutionary genetics community studying wild organisms. Here, genomic prediction is performed on eight traits in a wild population of Soay sheep. The population has been the focus of a >30 year evolutionary ecology study and there is already considerable understanding of the genetic architecture of the focal Mendelian and quantitative traits. We show that the accuracy of genomic prediction is high for all traits, but especially those with loci of large effect segregating. Five different methods are compared, and the two methods that can accommodate zero-effect and large-effect loci in the same model tend to perform best. If the accuracy of genomic prediction is similar in other wild populations, then there is a real opportunity for pedigree-free molecular quantitative genetics research to be enabled in many more wild populations; currently the literature is dominated by studies that have required decades of field data collection to generate sufficiently deep pedigrees. Finally, some of the potential applications of genomic prediction in wild populations are discussed.",Ovis aries,Sheep,https://datadryad.org/stash/dataset/doi:10.5061/dryad.h44j0zpkq,FALSE,TRUE,FALSE,FALSE,4737,35885,NA,genomic prediction; animal breeding; plant breeding; medical genetics; evolutionary genetics; quantitative traits; genetic architecture; wild populations
00094_GenomicPredictionSoaySheepHornlength,https://doi.org/10.5061/dryad.h44j0zpkq,https://onlinelibrary.wiley.com/doi/10.1111/mec.16262,Genomic prediction in the wild: A case study in Soay sheep,"Genomic prediction, the technique whereby an individual's genetic component of their phenotype is estimated from its genome, has revolutionised animal and plant breeding and medical genetics. However, despite being first introduced nearly two decades ago, it has hardly been adopted by the evolutionary genetics community studying wild organisms. Here, genomic prediction is performed on eight traits in a wild population of Soay sheep. The population has been the focus of a >30 year evolutionary ecology study and there is already considerable understanding of the genetic architecture of the focal Mendelian and quantitative traits. We show that the accuracy of genomic prediction is high for all traits, but especially those with loci of large effect segregating. Five different methods are compared, and the two methods that can accommodate zero-effect and large-effect loci in the same model tend to perform best. If the accuracy of genomic prediction is similar in other wild populations, then there is a real opportunity for pedigree-free molecular quantitative genetics research to be enabled in many more wild populations; currently the literature is dominated by studies that have required decades of field data collection to generate sufficiently deep pedigrees. Finally, some of the potential applications of genomic prediction in wild populations are discussed.",Ovis aries,Sheep,https://datadryad.org/stash/dataset/doi:10.5061/dryad.h44j0zpkq,FALSE,TRUE,FALSE,FALSE,472,36437,NA,genomic prediction; evolutionary genetics; animal breeding; quantitative traits; genetic architecture; Mendelian traits; wild populations; molecular quantitative genetics
00095_GenomicPredictionSoaySheepJaw,https://doi.org/10.5061/dryad.h44j0zpkq,https://onlinelibrary.wiley.com/doi/10.1111/mec.16262,Genomic prediction in the wild: A case study in Soay sheep,"Genomic prediction, the technique whereby an individual's genetic component of their phenotype is estimated from its genome, has revolutionised animal and plant breeding and medical genetics. However, despite being first introduced nearly two decades ago, it has hardly been adopted by the evolutionary genetics community studying wild organisms. Here, genomic prediction is performed on eight traits in a wild population of Soay sheep. The population has been the focus of a >30 year evolutionary ecology study and there is already considerable understanding of the genetic architecture of the focal Mendelian and quantitative traits. We show that the accuracy of genomic prediction is high for all traits, but especially those with loci of large effect segregating. Five different methods are compared, and the two methods that can accommodate zero-effect and large-effect loci in the same model tend to perform best. If the accuracy of genomic prediction is similar in other wild populations, then there is a real opportunity for pedigree-free molecular quantitative genetics research to be enabled in many more wild populations; currently the literature is dominated by studies that have required decades of field data collection to generate sufficiently deep pedigrees. Finally, some of the potential applications of genomic prediction in wild populations are discussed.",Ovis aries,Sheep,https://datadryad.org/stash/dataset/doi:10.5061/dryad.h44j0zpkq,FALSE,TRUE,FALSE,FALSE,897,36417,NA,genomic prediction; animal breeding; plant breeding; medical genetics; evolutionary genetics; wild populations; quantitative genetics; Soay sheep
00096_GenomicPredictionSoaySheepMetacarpal,https://doi.org/10.5061/dryad.h44j0zpkq,https://onlinelibrary.wiley.com/doi/10.1111/mec.16262,Genomic prediction in the wild: A case study in Soay sheep,"Genomic prediction, the technique whereby an individual's genetic component of their phenotype is estimated from its genome, has revolutionised animal and plant breeding and medical genetics. However, despite being first introduced nearly two decades ago, it has hardly been adopted by the evolutionary genetics community studying wild organisms. Here, genomic prediction is performed on eight traits in a wild population of Soay sheep. The population has been the focus of a >30 year evolutionary ecology study and there is already considerable understanding of the genetic architecture of the focal Mendelian and quantitative traits. We show that the accuracy of genomic prediction is high for all traits, but especially those with loci of large effect segregating. Five different methods are compared, and the two methods that can accommodate zero-effect and large-effect loci in the same model tend to perform best. If the accuracy of genomic prediction is similar in other wild populations, then there is a real opportunity for pedigree-free molecular quantitative genetics research to be enabled in many more wild populations; currently the literature is dominated by studies that have required decades of field data collection to generate sufficiently deep pedigrees. Finally, some of the potential applications of genomic prediction in wild populations are discussed.",Ovis aries,Sheep,https://datadryad.org/stash/dataset/doi:10.5061/dryad.h44j0zpkq,FALSE,TRUE,FALSE,FALSE,890,36432,NA,genomic prediction; evolutionary genetics; animal breeding; plant breeding; medical genetics; quantitative traits; Soay sheep; wild populations
